{"contract_version":"1.1.0","metric_name":"deadline","editor_id":"editor-42","ready_for_approval_at":"2026-09-07T15:00:00Z","requested_eta":"2026-09-07T17:00:00Z","requested_eta_selection":"latest-available-requested-eta","delta_seconds":-7200,"result":"early","evidence":{"source":"monday","monday_board_id":"board-1","monday_item_id":"item-1","column_ids":["status","requested_eta"],"event_ids":["event-101","event-eta-2"],"source_timestamps":["2026-09-07T15:00:00Z"],"source_values":{"ready_for_approval_at":"2026-09-07T15:00:00Z","latest_requested_eta":"2026-09-07T17:00:00Z"},"rule_version":"deadline-v1.1","calculated_at":"2026-09-08T00:00:00Z"}}
